{
    "identity":  {
                     "module_id":  "ROADMAPS-INDEX",
                     "name":  "Р В РІР‚СљР В Р’В»Р В Р’В°Р В Р вЂ Р В Р вЂ¦Р РЋРІР‚в„–Р В РІвЂћвЂ“ Р В РЎвЂР В Р вЂ¦Р В РўвЂР В Р’ВµР В РЎвЂќР РЋР С“ Р РЋР вЂљР В РЎвЂўР В Р’В°Р В РўвЂР В РЎВР В Р’В°Р В РЎвЂ”Р В РЎвЂўР В Р вЂ ",
                     "version":  "v2.1.0",
                     "created":  "2026-03-04",
                     "updated":  "2026-04-07",
                     "layer":  2,
                     "type":  "registry_index",
                     "description":  "Р В РІР‚СљР В Р’В»Р В Р’В°Р В Р вЂ Р В Р вЂ¦Р РЋРІР‚в„–Р В РІвЂћвЂ“ Р В РЎвЂР В Р вЂ¦Р В РўвЂР В Р’ВµР В РЎвЂќР РЋР С“ Р В Р вЂ Р РЋР С“Р В Р’ВµР РЋРІР‚В¦ Р РЋР вЂљР В РЎвЂўР В Р’В°Р В РўвЂР В РЎВР В Р’В°Р В РЎвЂ”Р В РЎвЂўР В Р вЂ  Р РЋР С“Р В РЎвЂР РЋР С“Р РЋРІР‚С™Р В Р’ВµР В РЎВР РЋРІР‚в„–",
                     "status":  "active",
                     "priority":  "high",
                     "tags":  [
                                  "roadmaps",
                                  "index",
                                  "registry",
                                  "tracking"
                              ],
                     "resonance":  "100%"
                 },
    "meta":  {
                 "description":  "Р В Р’В¦Р В Р’ВµР В Р вЂ¦Р РЋРІР‚С™Р РЋР вЂљР В Р’В°Р В Р’В»Р В РЎвЂР В Р’В·Р В РЎвЂўР В Р вЂ Р В Р’В°Р В Р вЂ¦Р В Р вЂ¦Р РЋРІР‚в„–Р В РІвЂћвЂ“ Р В РЎвЂР В Р вЂ¦Р В РўвЂР В Р’ВµР В РЎвЂќР РЋР С“ Р В Р вЂ Р РЋР С“Р В Р’ВµР РЋРІР‚В¦ Р РЋР вЂљР В РЎвЂўР В Р’В°Р В РўвЂР В РЎВР В Р’В°Р В РЎвЂ”Р В РЎвЂўР В Р вЂ  Р В Р вЂ  Р РЋР С“Р В РЎвЂР РЋР С“Р РЋРІР‚С™Р В Р’ВµР В РЎВР В Р’Вµ",
                 "update_frequency":  "Р В РЎвЂ”Р РЋР вЂљР В РЎвЂ Р В РЎвЂР В Р’В·Р В РЎВР В Р’ВµР В Р вЂ¦Р В Р’ВµР В Р вЂ¦Р В РЎвЂР В РЎвЂ",
                 "compliance":  "v2.1_standard"
             },
    "content":  {
                    "roadmaps":  {
                                     "active_roadmaps":  {
                                                             "RM-001":  {
                                                                            "name":  "Р В Р Р‹Р В РЎвЂР В РЎВР В Р’В±Р В РЎвЂР В РЎвЂўР В Р’В· Р В Р’В»Р РЋР вЂ№Р В РўвЂР В Р’ВµР В РІвЂћвЂ“ Р В РЎвЂ Р В Р’ВР В Р’В",
                                                                            "status":  "in_progress",
                                                                            "phase":  2,
                                                                            "priority":  "critical",
                                                                            "progress":  "70%"
                                                                        },
                                                             "RM-002":  {
                                                                            "name":  "Р В РІР‚ВР РЋРЎвЂњР В РўвЂР РЋРЎвЂњР РЋРІР‚В°Р В Р’ВµР В Р’Вµ Р В РЎС™Р В Р’В°Р В Р вЂ¦Р В РўвЂР В Р’В°Р В Р’В»Р РЋРІР‚в„–",
                                                                            "status":  "vision",
                                                                            "phase":  0,
                                                                            "priority":  "low",
                                                                            "progress":  "10%"
                                                                        },
                                                             "RM-004":  {
                                                                            "name":  "Р В РЎвЂ™Р РЋР вЂљР РЋРІР‚В¦Р В РЎвЂР РЋРІР‚С™Р В Р’ВµР В РЎвЂќР РЋРІР‚С™Р РЋРЎвЂњР РЋР вЂљР В Р вЂ¦Р В Р’В°Р РЋР РЏ Р В Р’В°Р В РўвЂР В Р’В°Р В РЎвЂ”Р РЋРІР‚С™Р В Р’В°Р РЋРІР‚В Р В РЎвЂР РЋР РЏ",
                                                                            "status":  "completed",
                                                                            "phase":  4,
                                                                            "priority":  "critical",
                                                                            "progress":  "100%"
                                                                        },
                                                             "RM-005":  {
                                                                            "name":  "Р В РІР‚ВР В Р’ВµР В Р’В·Р В РЎвЂўР В РЎвЂ”Р В Р’В°Р РЋР С“Р В Р вЂ¦Р В РЎвЂўР РЋР С“Р РЋРІР‚С™Р РЋР Р‰ Р В РЎвЂ Р РЋР вЂљР В Р’ВµР В Р’В·Р В РЎвЂўР В Р вЂ¦Р В Р’В°Р В Р вЂ¦Р РЋР С“",
                                                                            "status":  "in_progress",
                                                                            "phase":  1,
                                                                            "priority":  "high",
                                                                            "progress":  "40%"
                                                                        },
                                                             "RM-006":  {
                                                                            "name":  "Р В Р’ВР В Р вЂ¦Р РЋРІР‚С™Р В Р’ВµР В РЎвЂ“Р РЋР вЂљР В Р’В°Р РЋРІР‚В Р В РЎвЂР РЋР РЏ Р РЋР С“Р В РЎвЂР РЋР С“Р РЋРІР‚С™Р В Р’ВµР В РЎВ",
                                                                            "status":  "in_progress",
                                                                            "phase":  1,
                                                                            "priority":  "medium",
                                                                            "progress":  "30%"
                                                                        },
                                                             "RM-007":  {
                                                                            "name":  "Р В РЎС›Р В Р’ВµР РЋР С“Р РЋРІР‚С™Р В РЎвЂР РЋР вЂљР В РЎвЂўР В Р вЂ Р В Р’В°Р В Р вЂ¦Р В РЎвЂР В Р’Вµ Р В РЎвЂ Р В Р вЂ Р В Р’В°Р В Р’В»Р В РЎвЂР В РўвЂР В Р’В°Р РЋРІР‚В Р В РЎвЂР РЋР РЏ",
                                                                            "status":  "completed",
                                                                            "phase":  2,
                                                                            "priority":  "medium",
                                                                            "progress":  "100%"
                                                                        },
                                                             "RM-008":  {
                                                                            "name":  "Р В Р Р‹Р В РЎвЂР РЋР С“Р РЋРІР‚С™Р В Р’ВµР В РЎВР В Р’В° Р В РЎВР В РЎвЂўР В Р вЂ¦Р В РЎвЂР РЋРІР‚С™Р В РЎвЂўР РЋР вЂљР В РЎвЂР В Р вЂ¦Р В РЎвЂ“Р В Р’В° Р В РЎвЂ Р РЋР вЂљР В Р’ВµР В Р’ВµР РЋР С“Р РЋРІР‚С™Р РЋР вЂљР В Р’В°",
                                                                            "status":  "in_progress",
                                                                            "phase":  1,
                                                                            "priority":  "high",
                                                                            "progress":  "25%",
                                                                            "phase_1_completed":  "2026-03-07",
                                                                            "notes":  "Phase 1 CI/CD Р В Р’В·Р В Р’В°Р В Р вЂ Р В Р’ВµР РЋР вЂљР РЋРІвЂљВ¬Р В Р’ВµР В Р вЂ¦Р В Р’В°: GitHub Actions, auto-scan Р В РЎвЂ”Р РЋР вЂљР В РЎвЂ push, Р РЋР вЂљР В Р’В°Р РЋР С“Р В РЎвЂ”Р В РЎвЂР РЋР С“Р В Р’В°Р В Р вЂ¦Р В РЎвЂР В Р’Вµ 10:00 Р В РЎвЂ 22:00 Р В РЎС™Р В Р Р‹Р В РЎв„ў"
                                                                        },
                                                             "RM-009":  {
                                                                            "name":  "Automated Testing Suite",
                                                                            "status":  "planned",
                                                                            "phase":  0,
                                                                            "priority":  "medium",
                                                                            "progress":  "0%"
                                                                        },
                                                             "RM-010":  {
                                                                            "name":  "Р’РѕР·СЂРѕР¶РґРµРЅРёРµ Р–РёРІРѕРіРѕ РЇРґСЂР° (Living Core Revival)",
                                                                            "status":  "completed",
                                                                            "phase":  6,
                                                                            "priority":  "critical",
                                                                            "progress":  "100%",
                                                                            "completed_date":  "2026-04-07",
                                                                            "notes":  "РРЅС‚РµРіСЂРёСЂРѕРІР°РЅС‹ Initium v7.5.1, Philosophia v1.5.4, Geometria Sacra v1.0.1, Akasha Chronicorum v2.5.2, Sphaerae v2.3.2, Tectosphaera v2.0.6 РІ honeycombs v2.2+. Phase 1-6 Р·Р°РІРµСЂС€РµРЅС‹. Р–РёРІРѕРµ СЏРґСЂРѕ РІРѕР·РІСЂР°С‰РµРЅРѕ."
                                                                        }
                                                         },
                                     "archived_roadmaps":  {